"Blocked Domains", "Blocked Domains"
"Blocked Domain", "Blocked Domain"
"Blocked Texts", "Blocked Texts"
"Blocked Text", "Blocked Text"
"You're not allowed to subscribe", "You're not allowed to subscribe"
"You're not allowed to create an account", "You're not allowed to create an account"
"You're not allowed to contact us", "You're not allowed to make use of the contact form"
"Only domains is also possible (eg. qq.com)", "Only domains is also possible (eg. qq.com)"
"Use a comma to divide words. Text is not case sensitive", "Use a comma(,) to divide words. Text is not case sensitive"